{
  "requestId": "req-safezone-demo-001",
  "facility": {
    "facilityId": "FAC-PETRO-09",
    "name": "Apex Petrochemical Storage Yard",
    "location": {
      "latitude": 19.0760,
      "longitude": 72.8777,
      "elevationMeters": 12.0
    },
    "boundary": {
      "widthMeters": 300.0,
      "lengthMeters": 200.0,
      "polygon": [
        { "x": -50.0, "y": -50.0 },
        { "x": 250.0, "y": -50.0 },
        { "x": 250.0, "y": 150.0 },
        { "x": -50.0, "y": 150.0 }
      ]
    },
    "assets": [
      {
        "assetId": "T-101",
        "name": "LPG Storage Sphere 1",
        "type": "TANK",
        "position": {
          "x": 40.0,
          "y": 50.0,
          "z": 0.0
        },
        "dimensions": {
          "diameter": 14.0,
          "height": 16.0
        },
        "tankProperties": {
          "material": "LPG",
          "capacityM3": 1500.0,
          "fillLevelPercentage": 75.0,
          "operatingPressureBar": 8.5,
          "operatingTemperatureC": 28.0,
          "containmentDike": true
        }
      },
      {
        "assetId": "T-102",
        "name": "Propane Storage Sphere 2",
        "type": "TANK",
        "position": {
          "x": 95.0,
          "y": 50.0,
          "z": 0.0
        },
        "dimensions": {
          "diameter": 14.0,
          "height": 16.0
        },
        "tankProperties": {
          "material": "PROPANE",
          "capacityM3": 1500.0,
          "fillLevelPercentage": 60.0,
          "operatingPressureBar": 9.2,
          "operatingTemperatureC": 28.0,
          "containmentDike": true
        }
      },
      {
        "assetId": "BLD-CTRL",
        "name": "Main Control Room",
        "type": "BUILDING",
        "position": {
          "x": 180.0,
          "y": 110.0,
          "z": 0.0
        },
        "dimensions": {
          "length": 30.0,
          "width": 20.0,
          "height": 8.0
        }
      },
      {
        "assetId": "EXIT-MAIN-GATE",
        "name": "North Perimeter Main Gate",
        "type": "EXIT",
        "position": {
          "x": 220.0,
          "y": 140.0,
          "z": 0.0
        }
      }
    ],
    "escapeRoutes": [
      {
        "routeId": "ROUTE-NORTH",
        "name": "North Gate Evacuation Corridor",
        "points": [
          { "x": 180.0, "y": 100.0 },
          { "x": 180.0, "y": 140.0 },
          { "x": 220.0, "y": 140.0 }
        ]
      },
      {
        "routeId": "ROUTE-WEST",
        "name": "West Perimeter Evacuation Path",
        "points": [
          { "x": 50.0, "y": 20.0 },
          { "x": 10.0, "y": 20.0 },
          { "x": -40.0, "y": 20.0 }
        ]
      }
    ],
    "blockages": [
      {
        "blockageId": "WALL-BLAST-01",
        "type": "BLAST_WALL",
        "attenuationFactor": 0.65,
        "heightMeters": 4.5,
        "points": [
          { "x": 68.0, "y": 30.0 },
          { "x": 68.0, "y": 70.0 }
        ]
      }
    ]
  },
  "incident": {
    "sourceAssetId": "T-101",
    "incidentType": "VAPOR_CLOUD_EXPLOSION",
    "parameters": {
      "fuelMassKg": 4500.0,
      "tntEquivalentMassKg": 675.0,
      "firePoolDiameterMeters": 22.0,
      "releaseDurationSeconds": 45.0
    }
  },
  "wind": {
    "speedMps": 6.5,
    "directionDegreesFromNorth": 112.5,
    "directionCompass": "ESE",
    "unit": "METRIC"
  },
  "environment": {
    "ambientTemperatureC": 32.0,
    "relativeHumidityPercentage": 65.0,
    "atmosphericPressureKPa": 101.325,
    "stabilityClass": "D",
    "solarRadiationWm2": 650.0
  },
  "simulationConfig": {
    "thermalCalculationEnabled": true,
    "blastCalculationEnabled": true,
    "dominoAnalysisEnabled": true,
    "gridResolutionMeters": 2.0,
    "timeHorizonSeconds": 600.0
  }
}
